{
  "$schema": "../character.schema.json",
  "id": "shark",
  "name": "Shark",
  "description": "Puppetz mascot: a shark that stands like a dinosaur - forward-leaning torpedo body, pointed snout with an underslung hinged jaw, dorsal fin, long tail with a crescent fin, short arms and strong legs.",
  "version": 2,
  "units": "meters",
  "up": "+Y",
  "forward": "+Z",
  "symmetry": { "left": "_L", "right": "_R" },

  "materials": {
    "skin":     { "color": "#7d929f", "roughness": 0.42, "clearcoat": 0.35, "clearcoatRoughness": 0.35 },
    "skinDark": { "color": "#4c5e69", "roughness": 0.55 },
    "belly":    { "color": "#eef1f3", "roughness": 0.5 },
    "mouth":    { "color": "#6b2430", "roughness": 0.7 },
    "tooth":    { "color": "#ffffff", "roughness": 0.25 },
    "claw":     { "color": "#e6e1d6", "roughness": 0.4 },
    "eye":      { "color": "#0c0e11", "roughness": 0.1, "clearcoat": 1 },
    "glint":    { "color": "#ffffff", "emissive": "#ffffff", "emissiveIntensity": 1 },
    "fish":     { "color": "#f29a2e", "roughness": 0.4 },
    "pupil":    { "color": "#111111", "roughness": 0.2 }
  },

  "skeleton": [
    { "name": "root",       "parent": null },
    { "name": "hips",       "parent": "root",       "position": [0, 0.51, 0] },
    { "name": "spine",      "parent": "hips",       "position": [0, 0.02, 0],  "rotation": [40, 0, 0], "limits": { "x": [-25, 25], "y": [-30, 30], "z": [-20, 20] } },
    { "name": "chest",      "parent": "spine",      "position": [0, 0.36, 0],  "limits": { "x": [-20, 20], "y": [-25, 25], "z": [-15, 15] } },
    { "name": "head",       "parent": "chest",      "position": [0, 0.16, 0],  "rotation": [45, 0, 0], "limits": { "x": [-30, 30], "y": [-15, 15], "z": [-50, 50] } },
    { "name": "jaw",        "parent": "head",       "position": [0, 0.07, 0.07], "limits": { "x": [0, 35], "y": [0, 0], "z": [-5, 5] } },
    { "name": "eye_L",      "parent": "head",       "position": [0.128, 0.2, -0.035], "mirror": true, "limits": { "x": [-20, 20], "y": [0, 0], "z": [-25, 25] } },
    { "name": "tail",       "parent": "hips",       "position": [0, 0.04, -0.12], "rotation": [-100, 0, 0], "limits": { "x": [-30, 30], "y": [-20, 20], "z": [-40, 40] } },
    { "name": "tailFin",    "parent": "tail",       "position": [0, 0.55, 0],  "limits": { "x": [-30, 30], "y": [-20, 20], "z": [-45, 45] } },

    { "name": "upperArm_L", "parent": "chest",      "position": [0.17, 0.0, 0.08], "rotation": [-70, 0, 20], "mirror": true, "tags": ["arm"] },
    { "name": "foreArm_L",  "parent": "upperArm_L", "position": [0, -0.12, 0],    "rotation": [-40, 0, 0],  "mirror": true, "tags": ["arm"], "limits": { "x": [-100, 30], "y": [-40, 40], "z": [-40, 40] } },
    { "name": "hand_L",     "parent": "foreArm_L",  "position": [0, -0.1, 0],     "mirror": true, "tags": ["arm"] },
    { "name": "food",       "parent": "hand_R",     "position": [0, -0.06, 0.02], "scale": 0.01, "tags": ["prop"] },

    { "name": "thigh_L",    "parent": "hips",       "position": [0.13, -0.02, 0], "mirror": true, "tags": ["leg"], "limits": { "x": [-90, 45], "y": [-30, 30], "z": [-20, 45] } },
    { "name": "shin_L",     "parent": "thigh_L",    "position": [0, -0.22, 0],    "mirror": true, "tags": ["leg"], "limits": { "x": [0, 140], "y": [0, 0], "z": [0, 0] } },
    { "name": "foot_L",     "parent": "shin_L",     "position": [0, -0.22, 0],    "mirror": true, "tags": ["leg"], "limits": { "x": [-45, 45], "y": [-20, 20], "z": [-20, 20] } }
  ],

  "parts": [
    { "name": "torso", "bone": "spine", "material": "skin",
      "geometry": { "type": "lathe", "segments": 48, "points": [[0, -0.2], [0.12, -0.17], [0.2, -0.08], [0.24, 0.06], [0.245, 0.18], [0.22, 0.32], [0.18, 0.44], [0.15, 0.53], [0.09, 0.59], [0, 0.61]] } },
    { "name": "bellyPatch", "bone": "spine", "material": "belly", "position": [0, 0.1, 0.1], "scale": [0.2, 0.32, 0.152],
      "geometry": { "type": "sphere", "radius": 1 } },
    { "name": "dorsalFin", "bone": "spine", "material": "skin", "position": [0, 0.3, -0.2], "rotation": [-90, 90, 0],
      "geometry": { "type": "extrude", "smooth": true, "depth": 0.012, "bevel": 0.008, "curveSegments": 20, "bevelSegments": 2,
                    "points": [[0, 0], [-0.03, 0.1], [-0.08, 0.19], [-0.12, 0.27], [-0.03, 0.17], [0.08, 0.07], [0.2, 0.01], [0.25, 0]] } },
    { "name": "gill1_L", "bone": "chest", "material": "skinDark", "mirror": true, "mirrorFlip": true,
      "geometry": { "type": "tube", "radius": 0.007, "points": [[0.198, 0.02, -0.07], [0.212, 0.03, 0.0], [0.198, 0.02, 0.07]] } },
    { "name": "gill2_L", "bone": "chest", "material": "skinDark", "mirror": true, "mirrorFlip": true,
      "geometry": { "type": "tube", "radius": 0.007, "points": [[0.19, 0.055, -0.07], [0.204, 0.065, 0.0], [0.19, 0.055, 0.07]] } },
    { "name": "gill3_L", "bone": "chest", "material": "skinDark", "mirror": true, "mirrorFlip": true,
      "geometry": { "type": "tube", "radius": 0.007, "points": [[0.18, 0.09, -0.065], [0.193, 0.1, 0.0], [0.18, 0.09, 0.065]] } },
    { "name": "gill4_L", "bone": "chest", "material": "skinDark", "mirror": true, "mirrorFlip": true,
      "geometry": { "type": "tube", "radius": 0.007, "points": [[0.17, 0.125, -0.06], [0.183, 0.135, 0.0], [0.17, 0.125, 0.06]] } },
    { "name": "gill5_L", "bone": "chest", "material": "skinDark", "mirror": true, "mirrorFlip": true,
      "geometry": { "type": "tube", "radius": 0.007, "points": [[0.16, 0.16, -0.055], [0.172, 0.17, 0.0], [0.16, 0.16, 0.055]] } },

    { "name": "headSkin", "bone": "head", "material": "skin", "scale": [1, 1, 0.8],
      "geometry": { "type": "lathe", "segments": 48, "points": [[0, -0.1], [0.12, -0.09], [0.168, -0.02], [0.172, 0.06], [0.16, 0.16], [0.135, 0.25], [0.1, 0.33], [0.06, 0.39], [0.025, 0.425], [0, 0.435]] } },
    { "name": "throat", "bone": "head", "material": "belly", "position": [0, 0.06, 0.065], "scale": [0.13, 0.13, 0.075],
      "geometry": { "type": "sphere", "radius": 1 } },
    { "name": "nostril_L", "bone": "head", "material": "skinDark", "position": [0.032, 0.36, 0.045], "scale": [1, 1.6, 0.6], "mirror": true,
      "geometry": { "type": "sphere", "radius": 0.008, "widthSegments": 12, "heightSegments": 8 } },
    { "name": "mouthInside", "bone": "head", "material": "mouth", "position": [0, 0.18, 0.085], "scale": [0.1, 0.12, 0.02],
      "geometry": { "type": "sphere", "radius": 1 } },
    { "name": "toothFront_L", "bone": "head", "material": "tooth", "position": [0.022, 0.275, 0.092], "rotation": [90, 0, 0], "mirror": true,
      "geometry": { "type": "cone", "radius": 0.011, "height": 0.03, "radialSegments": 8 } },
    { "name": "toothMid_L", "bone": "head", "material": "tooth", "position": [0.055, 0.25, 0.098], "rotation": [90, 0, 0], "mirror": true,
      "geometry": { "type": "cone", "radius": 0.011, "height": 0.03, "radialSegments": 8 } },
    { "name": "toothSide_L", "bone": "head", "material": "tooth", "position": [0.082, 0.21, 0.104], "rotation": [90, 0, 0], "mirror": true,
      "geometry": { "type": "cone", "radius": 0.011, "height": 0.028, "radialSegments": 8 } },
    { "name": "toothBack_L", "bone": "head", "material": "tooth", "position": [0.1, 0.165, 0.108], "rotation": [90, 0, 0], "mirror": true,
      "geometry": { "type": "cone", "radius": 0.01, "height": 0.024, "radialSegments": 8 } },

    { "name": "jawSkin", "bone": "jaw", "material": "belly", "position": [0, 0.1, 0.03], "scale": [0.115, 0.13, 0.045],
      "geometry": { "type": "sphere", "radius": 1 } },

    { "name": "eyeball_L", "bone": "eye_L", "material": "eye", "mirror": true,
      "geometry": { "type": "sphere", "radius": 0.027 } },
    { "name": "glint_L", "bone": "eye_L", "material": "glint", "position": [0.014, 0.01, -0.019], "castShadow": false, "mirror": true,
      "geometry": { "type": "sphere", "radius": 0.006, "widthSegments": 8, "heightSegments": 6 } },

    { "name": "tailSkin", "bone": "tail", "material": "skin",
      "geometry": { "type": "lathe", "segments": 32, "points": [[0.2, -0.05], [0.19, 0.05], [0.15, 0.2], [0.1, 0.35], [0.065, 0.48], [0.045, 0.56], [0, 0.59]] } },
    { "name": "caudalFin", "bone": "tailFin", "material": "skin", "position": [0, -0.03, 0], "rotation": [90, 90, 0],
      "geometry": { "type": "extrude", "smooth": true, "depth": 0.014, "bevel": 0.009, "curveSegments": 20, "bevelSegments": 2,
                    "points": [[0, 0.05], [0.1, 0.16], [0.22, 0.3], [0.31, 0.39], [0.25, 0.22], [0.18, 0.08], [0.15, 0.02], [0.2, -0.1], [0.25, -0.19], [0.12, -0.1], [0, -0.05]] } },

    { "name": "shoulder_L", "bone": "upperArm_L", "material": "skin", "mirror": true,
      "geometry": { "type": "sphere", "radius": 0.045 } },
    { "name": "upperArmSkin_L", "bone": "upperArm_L", "material": "skin", "position": [0, -0.06, 0], "mirror": true,
      "geometry": { "type": "capsule", "radius": 0.038, "length": 0.07 } },
    { "name": "foreArmSkin_L", "bone": "foreArm_L", "material": "skin", "position": [0, -0.05, 0], "mirror": true,
      "geometry": { "type": "capsule", "radius": 0.033, "length": 0.06 } },
    { "name": "handSkin_L", "bone": "hand_L", "material": "skin", "position": [0, -0.03, 0], "scale": [0.6, 1, 0.9], "mirror": true,
      "geometry": { "type": "sphere", "radius": 0.042 } },
    { "name": "finger1_L", "bone": "hand_L", "material": "claw", "position": [0.012, -0.06, 0.004], "mirror": true,
      "geometry": { "type": "horn", "radiusStart": 0.009, "points": [[0, 0, 0], [0, -0.018, 0.004], [0, -0.03, 0.014]] } },
    { "name": "finger2_L", "bone": "hand_L", "material": "claw", "position": [-0.012, -0.06, 0.004], "mirror": true,
      "geometry": { "type": "horn", "radiusStart": 0.009, "points": [[0, 0, 0], [0, -0.018, 0.004], [0, -0.03, 0.014]] } },

    { "name": "fishBody", "bone": "food", "material": "fish", "position": [0, -0.04, 0], "scale": [0.03, 0.09, 0.045],